question,answer,retrieved_sources
Какая планета самая большая в Солнечной системе?,"Титан — крупнейший спутник Сатурна и второй по величине спутник в Солнечной системе. Юпитер — крупнейшая планета Солнечной системы, газовый гигант.","doc_05, doc_05, doc_14"
Почему Венера такая горячая?,— это самая горячая планета Солнечной системы. Венера — вторая планета от Солнца и ближайшая соседка Земли.,"doc_02, doc_02, doc_10"
Что особенного в спутнике Европа?,"У планеты более 90 известных спутников, крупнейшие из них — Ио, Европа, Ганимед и Каллисто. Европа — четвёртый по размеру спутник Юпитера, один из наиболее перспективных объектов для поиска внеземной жизни.","doc_13, doc_05, doc_13"
Что такое Большое Красное Пятно на Юпитере?,"Знаменитое Большое Красное Пятно — это гигантский атмосферный Красное Пятно — это гигантский атмосферный вихрь, существующий не менее 350 лет.","doc_05, doc_05, doc_11"
Когда следующее появление кометы Галлея?,Следующее появление кометы ожидается около 2061 Следующее появление кометы ожидается около 2061 года.,"doc_15, doc_15, doc_15"
Самая маленькая планета Солнечной системы?,Меркурий — ближайшая к Солнцу планета Солнечной системы. Это самая маленькая планета среди восьми: её радиус составляет около 2440 км.,"doc_01, doc_07, doc_03"
Какой спутник Земли?,Луна — единственный естественный спутник Земли.,"doc_07, doc_09, doc_05"
Из чего состоит Солнце?,"Солнце состоит преимущественно из водорода и гелия. Солнце обеспечивает планеты теплом и светом, необходимыми для жизни.","doc_10, doc_10, doc_10"
